{
  "schema_version": "1.0.0",
  "run_id": "1051531a-f94f-4814-802f-f2fa711aa969",
  "created_at": "2026-08-04T06:14:27.729611+00:00",
  "mode": "replay",
  "synthetic": true,
  "tool": {
    "name": "armsmith",
    "version": "0.1.0"
  },
  "scenario": "scenario_ragserve",
  "repo": {
    "url": "https://github.com/example/ragserve",
    "sha": "0000000000000000000000000000000000000000"
  },
  "host": {
    "architecture": "aarch64",
    "model_name": "Neoverse-V2",
    "vendor": "ARM",
    "cpus": 16,
    "isa_feats": [
      "dotprod",
      "i8mm",
      "sve",
      "sve2",
      "bf16"
    ],
    "isa": {
      "dotprod": true,
      "i8mm": true,
      "sve": true,
      "sve2": true,
      "bf16": true,
      "sme": false
    },
    "instance": "synthetic-c8g.4xlarge",
    "kernel": "6.8.0-synthetic",
    "governor": "performance",
    "source": "replay[SYNTHETIC]: scenario_ragserve"
  },
  "gate_config": {
    "band_k": 3.0,
    "min_samples": 3,
    "require_output_hash": true,
    "primary_metrics": null
  },
  "findings": [
    {
      "rule_id": "R1",
      "status": "matched",
      "evidence": [
        "Dockerfile:1: FROM pinned to linux/amd64 \u2192 QEMU emulation on arm64 hosts"
      ],
      "locations": [
        "Dockerfile:1"
      ],
      "fix": {
        "rule_id": "R1",
        "kind": "dockerfile_edit",
        "description": "Remove the amd64 platform pin so the native arm64 image variant is pulled; if the base image is amd64-only, switch to a multi-arch base or add a buildx multi-platform build.",
        "patch": "- FROM --platform=linux/amd64 python:3.12-slim\n+ FROM python:3.12-slim",
        "commands": [
          "docker buildx imagetools inspect <base-image>  # confirm arm64 variant exists"
        ]
      },
      "skipped_reason": null
    },
    {
      "rule_id": "R2",
      "status": "skipped",
      "evidence": [],
      "locations": [],
      "fix": null,
      "skipped_reason": "probe data not recorded: ['build_log']"
    },
    {
      "rule_id": "R3",
      "status": "matched",
      "evidence": [
        "no optimized BLAS (OpenBLAS/BLIS/ArmPL/Accelerate/MKL) in numpy.show_config()",
        "reference-BLAS marker: \"libraries = ['blas'\"",
        "1 backend section(s) report NOT AVAILABLE"
      ],
      "locations": [
        "probe:numpy_show_config"
      ],
      "fix": {
        "rule_id": "R3",
        "kind": "pip_pin",
        "description": "Reinstall NumPy from the official PyPI manylinux aarch64 wheel (bundles OpenBLAS) instead of the distro/source build, and pin it in the lockfile.",
        "patch": "numpy>=1.26  # official manylinux_aarch64 wheels bundle OpenBLAS",
        "commands": [
          "pip install --force-reinstall --only-binary=:all: numpy",
          "python -c \"import numpy; numpy.show_config()\"  # re-verify backend"
        ]
      },
      "skipped_reason": null
    },
    {
      "rule_id": "R4",
      "status": "matched",
      "evidence": [
        "app.py:5: np.array(...) without dtype= \u2014 floats default to float64",
        "app.py:6: np.ones(...) without dtype= \u2014 floats default to float64"
      ],
      "locations": [
        "app.py:5",
        "app.py:6"
      ],
      "fix": {
        "rule_id": "R4",
        "kind": "code_suggestion",
        "description": "Pin dtype=np.float32 at each flagged numpy constructor call site; keep a single explicit cast at the model boundary if float64 is genuinely required somewhere.",
        "patch": "app.py:5: add dtype=np.float32 to np.array(...)\napp.py:6: add dtype=np.float32 to np.ones(...)",
        "commands": []
      },
      "skipped_reason": null
    },
    {
      "rule_id": "R5",
      "status": "skipped",
      "evidence": [],
      "locations": [],
      "fix": null,
      "skipped_reason": "probe data not recorded: ['gguf_header']"
    },
    {
      "rule_id": "R6",
      "status": "matched",
      "evidence": [
        "workers(4) \u00d7 threads/worker(16) = 64 runnable threads on 16 vCPUs (4.0\u00d7 oversubscribed)",
        "thread source: no thread env set \u2192 OpenMP default = nproc per worker",
        "worker source: Dockerfile CMD gunicorn -w 4 (recorded)"
      ],
      "locations": [
        "probe:env"
      ],
      "fix": {
        "rule_id": "R6",
        "kind": "env_change",
        "description": "Cap per-worker threads so workers \u00d7 threads matches the vCPU budget: OMP_NUM_THREADS=4 (and mirror to OPENBLAS_NUM_THREADS) with 4 workers on 16 vCPUs.",
        "patch": "OMP_NUM_THREADS=4\nOPENBLAS_NUM_THREADS=4",
        "commands": []
      },
      "skipped_reason": null
    },
    {
      "rule_id": "R7",
      "status": "skipped",
      "evidence": [],
      "locations": [],
      "fix": null,
      "skipped_reason": "probe data not recorded: ['ort_session']"
    },
    {
      "rule_id": "R8",
      "status": "matched",
      "evidence": [
        "numpy-1.24.0 downloaded as sdist \u2014 no aarch64 wheel used (wheel built from source in this log)"
      ],
      "locations": [
        "probe:pip_install_log"
      ],
      "fix": {
        "rule_id": "R8",
        "kind": "pip_pin",
        "description": "Pin flagged packages to versions that publish manylinux aarch64 wheels and enforce --only-binary for the watchlist so CI fails loudly instead of silently compiling untuned builds.",
        "patch": "numpy  # pin to a release with manylinux_*_aarch64 wheels",
        "commands": [
          "pip install --only-binary=:all: numpy"
        ]
      },
      "skipped_reason": null
    },
    {
      "rule_id": "R9",
      "status": "clean",
      "evidence": [
        "memcpy-family symbols account for 6.1% of cycles (< 15% threshold)"
      ],
      "locations": [],
      "fix": null,
      "skipped_reason": null
    },
    {
      "rule_id": "R10",
      "status": "skipped",
      "evidence": [],
      "locations": [],
      "fix": null,
      "skipped_reason": "probe data not recorded: ['cmake_cache']"
    },
    {
      "rule_id": "R11",
      "status": "matched",
      "evidence": [
        "transparent hugepages disabled (enabled='always madvise [never]') \u2014 multi-GB model heaps pay 4K-page TLB pressure",
        "no tcmalloc/jemalloc mapped \u2014 glibc malloc fragmentation tax on long-lived multi-GB heaps",
        "THP raw: 'always madvise [never]'",
        "allocators in maps: none"
      ],
      "locations": [
        "probe:thp",
        "probe:proc_maps"
      ],
      "fix": {
        "rule_id": "R11",
        "kind": "env_change",
        "description": "Environment-level tuning, A/B-able with zero code change: set THP to madvise and/or preload a modern allocator for the serving process.",
        "patch": "# THP (needs root; persist via tuned/sysfs unit)\necho madvise > /sys/kernel/mm/transparent_hugepage/enabled\n# allocator preload for the serving process\nLD_PRELOAD=/usr/lib/aarch64-linux-gnu/libjemalloc.so.2",
        "commands": []
      },
      "skipped_reason": null
    },
    {
      "rule_id": "R12",
      "status": "matched",
      "evidence": [
        ".github/workflows/publish.yml: job 'image' step 2: build-push-action platforms=(unset \u2192 runner arch only) \u2014 no linux/arm64"
      ],
      "locations": [
        ".github/workflows/publish.yml"
      ],
      "fix": {
        "rule_id": "R12",
        "kind": "ci_patch",
        "description": "Add linux/arm64 to the image build matrix: either platforms: linux/amd64,linux/arm64 on the buildx step (with docker/setup-qemu-action + docker/setup-buildx-action), or build natively on the free public-repo arm64 runners.",
        "patch": "# option A \u2014 buildx multi-arch on the existing runner\n      - uses: docker/setup-qemu-action@v3\n      - uses: docker/setup-buildx-action@v3\n      - uses: docker/build-push-action@v6\n        with:\n          platforms: linux/amd64,linux/arm64\n# option B \u2014 native arm64 job (free for public repos)\n  build-arm64:\n    runs-on: ubuntu-24.04-arm\n",
        "commands": []
      },
      "skipped_reason": null
    },
    {
      "rule_id": "R13",
      "status": "skipped",
      "evidence": [],
      "locations": [],
      "fix": null,
      "skipped_reason": "probe data not recorded: ['llama_bench', 'hyperfine']"
    }
  ],
  "plan": [
    {
      "rule_id": "R1",
      "rationale": "confidence=high, expected-gain midpoint 6.00x (estimate for ordering only; the reproduce gate decides)",
      "priority": 0
    },
    {
      "rule_id": "R3",
      "rationale": "confidence=high, expected-gain midpoint 3.25x (estimate for ordering only; the reproduce gate decides)",
      "priority": 1
    },
    {
      "rule_id": "R6",
      "rationale": "confidence=high, expected-gain midpoint 2.10x (estimate for ordering only; the reproduce gate decides)",
      "priority": 2
    },
    {
      "rule_id": "R4",
      "rationale": "confidence=high, expected-gain midpoint 1.65x (estimate for ordering only; the reproduce gate decides)",
      "priority": 3
    },
    {
      "rule_id": "R12",
      "rationale": "confidence=high, expected-gain midpoint 1.00x (estimate for ordering only; the reproduce gate decides)",
      "priority": 4
    },
    {
      "rule_id": "R8",
      "rationale": "confidence=medium, expected-gain midpoint 2.10x (estimate for ordering only; the reproduce gate decides)",
      "priority": 5
    },
    {
      "rule_id": "R11",
      "rationale": "confidence=medium, expected-gain midpoint 1.18x (estimate for ordering only; the reproduce gate decides)",
      "priority": 6
    }
  ],
  "baseline": {
    "variant": "baseline",
    "instrument": "hyperfine",
    "rule_id": null,
    "synthetic": true,
    "samples": {
      "wall_s": [
        2.01,
        1.98,
        2.03,
        2.0,
        1.99,
        2.02,
        2.0
      ],
      "rss_peak_mb": [
        512.0,
        514.0,
        511.0,
        513.0,
        512.0,
        512.5,
        513.5
      ]
    },
    "metrics_summary": {